{
  "$schema": "https://json-schema.org/draft/2020-12/schema",
  "$id": "https://savedyouatoken.com/contracts/v1/baseline.schema.json",
  "title": "Saved You a Token baseline",
  "type": "object",
  "required": ["contract", "provenance", "reportId", "workflow", "release"],
  "properties": {
    "contract": { "type": "object", "required": ["kind", "version"], "properties": { "kind": { "const": "baseline" }, "version": { "type": "object", "required": ["major", "minor"], "properties": { "major": { "const": 1 }, "minor": { "type": "integer", "minimum": 0 } } } } },
    "provenance": { "type": "object", "required": ["producer", "producerVersion", "generatedAt"], "properties": { "producer": { "type": "string" }, "producerVersion": { "type": "string" }, "generatedAt": { "type": "string", "format": "date-time" }, "sourceContractVersion": { "$ref": "#/$defs/sourceVersion" } } },
    "reportId": { "type": "string", "pattern": "^sha256:[a-f0-9]{64}$" },
    "workflow": { "type": "object", "required": ["id"], "properties": { "id": { "type": "string" }, "environment": { "type": "string" } } },
    "release": { "type": "object", "required": ["id"], "properties": { "id": { "type": "string" }, "deployedAt": { "type": "string", "format": "date-time" } } }
  },
  "$defs": {
    "sourceVersion": { "type": "object", "required": ["major", "minor"], "properties": { "major": { "type": "integer", "minimum": 0 }, "minor": { "type": "integer", "minimum": 0 } } }
  }
}
