{
  "contract": { "kind": "baseline", "version": { "major": 1, "minor": 0 } },
  "provenance": { "producer": "savedyouatoken", "producerVersion": "0.0.9", "generatedAt": "2026-08-12T14:00:00.000Z" },
  "reportId": "sha256:bbbbbbbbbbbbbbbbbbbbbbbbbbbbbbbbbbbbbbbbbbbbbbbbbbbbbbbbbbbbbbbb",
  "workflow": { "id": "support/triage" },
  "release": { "id": "abc122" }
}
