{"contract":{"kind":"baseline","version":{"major":1,"minor":1}},"provenance":{"generatedAt":"2026-08-13T14:00:00.000Z","producer":"savedyouatoken","producerVersion":"0.1.0"},"release":{"id":"abc123"},"reportId":"sha256:aaaaaaaaaaaaaaaaaaaaaaaaaaaaaaaaaaaaaaaaaaaaaaaaaaaaaaaaaaaaaaaa","workflow":{"environment":"production","id":"support/triage"}}
